post_id,body,score,contains_term
1gkvvwi,"When fighting with closed comedones we need to remember that it requires patience and regularity. So having that in mind, lets focus on 3 main areas 1. Cleansing 2. Exfoliation 3. Moisturizing 1. CLEANSING MORNING 1. Gentle cleansing gel or foam with no actives in it. I really like Cetaphil products but it s a very individual matter so u need to find the perfect match on your own. EVENING If u wear makeup or SPF - double cleansing in the evening is a MUST. 1. Product based on oil don t worry not every oil is harmful for your oily combination skin, in fact it s great in terms of deep cleansing which is crucial in anty closed comedones routine . I have acne and since I started using oil based cleansing product, I truly see the difference. 2. Product with gelly or foam formula - it s going to be our emulsifier to dissolve the leftover oil. Friendly note remember to wash your face in lukewarm water, have a separate cotton towel dedicated to your face and change it minimum once a week I change them every 2 3 days . 2. EXFOLIATION very important What it does? Exfoliants gets rid of dead cells accumulated on the skin surface and that leads to unclogging of pores and deep clean them. There s many exfoliants on the market. U mentioned salicylic acid which is a really good one however a concentration of 2 is insufficient to cleanse pores. Considering your irritated and sensitive yet quite oily skin, I would recommend mandelic acid 5 . Further in the process you can switch to 10 . How often? Start small once a week. After 2 3 weeks u can do it twice a week. Friendly note apply a small amount of product each use. Observe your skin and give it time. 3. MOISTURIZING Last but def not least step! If we missed this step, we would get even more oily skin production of sebum is our skin s defense mechanism and irritated skin. Choose light yet rich formulas. Seek for products that are dedicated to acne prone skin cause that kind of products shouldn t clogged your pores. Personally I really like CeraVe Moisturizing lotion with ceramides and hyaluronic acid. Use it in the morning and evening. Additional things hydrate yourself hydration from the inside is super helpful in process of reducing skin problems change your pillow covers regularly pay attention to your diet veggies are great but be careful with fructose and lactose intake Move your body more often for me it was a game changer, also its a science based claim don t forget about SPF even on cloudy days I hope that will be helpful 3 Lots of love and if u have any questions, im here for you!",3,True
1gkgkpu,"I have read everything again and although it could be demodicosis, I think it is actually the altered skin barrier. You use exfoliating acids that are too powerful. I would stop for a while to recover the skin. Cerave s SA cleanser is quite irritating on some skin. The routine that I recommend is AM Bioderma Gel Cleanser pink bottle , Theramid Derma-Peptides with growth factors, SPF PM 0.2 or 0.3 retinol and not every day, to avoid adding sensitivity to the skin. After retinol, a cream with ceramides. When the skin is more recovered, I would add Anua s BHA toner as the only exfoliant.",3,True
1gk95xk,"To clarify, the cleanser is the Purifying Foam right? I plan to add CeraVe Moisturizer Cream to the routine to help moisturize my face. And yes, I also plan to use my LRP products at night only.",1,True
1gk95xk,"Now I m using the Cicaplast Baume B5 until my skin is repaired. So in the evening I would use Cicaplast and the Effaclar Duo as an acne-spot treatment, but could you recommend me what gentler and more hydrating products I could use every day and that I can use on my whole face? I heard CeraVe is a good one but still not sure.",1,True
1gk95xk,"Cerave Hydrating Cleanser? Potentially. Weirdly enough, while ceramides are there for barrier support, some people with impaired skin barriers can experience stinging. But there ll always be something that didn t work for someone. I m not sure how drying Effaclar Duo is - maybe it s just not moisturising enough, especially when paired with a harsher cleanser? If so, you could still use it, just with something else on top for drier areas. Also, it s not uncommon to use lighter moisturisers in the morning and heavier ones in the evening. Together with a more heavy-duty cleanser in the evening and a gentler one in the morning. I m sorry it s so much hassle to figure this skincare stuff up!",1,True
1gk95xk,"No, if anything I m the one who should be sorry for being so clueless because it s such a brand new thing for me and I really don t have any knowledge of skincare products. From what I ve gathered, in the morning I could use CeraVe Hydrating Cleanser and in the evening I could use all the three products of La Roche-Posay that I own, is that right? The Purifying Foaming Gel first, then the Effaclar for my acne and then the Cicaplast for repairing the dryness of my skin? Or should I just use one of these? Again, sorry for asking all these questions.",1,True
1gjcpab,It ll probably make you break out into a bee sting victim because it s Cerave anyway winking_face,1,True
1gixuep,"I m assuming your concerns are acne and hydration. AM routine 1. Cleansing you can choose to only splash your face with warm water in the morning if you feel your skin is getting irritated and leave the cleanser for the PM CeraVe Acne Foaming Cleanser in the shower. It contains salicylic acid which helps acne. Switching to the CeraVe Renewing SA Cleanser at the sink is a smart idea, especially if you find it less irritating. However, using both cleansers back-to-back may be too much for some skin types, particularly if your skin is sensitive or dry. You could consider alternating between the two cleansers based on your skin s condition. 2. Serum CeraVe Hyaluronic Acid Serum will add an extra layer of hydration. It s best applied on slightly damp skin for optimal absorption! 3. Moisturizing CeraVe Moisturizing Cream is excellent for hydration and also restores the skin barrier it contains ceramides and hyaluronic acid . Pay attention to your skin because some people do mention they break out from it! 4. Sunscreen do not skip this especially when using Tretinoin! You can lead to scarring and hyperpigmentation in addition to sun damage. PM routine 1. Cleansing same as AM 2. Serum same as AM 3. Tretinoin super effective for acne and improving skin texture. Gradually increase this and even use it on alternating nights if you feel your skin is a bit sensitive. This needs to be applied onto dry skin! I 4. Moisturizing same as AM The HA serum should be enough to sandwich the tretinoin with moisture so it doesn t irritate or dry out your skin. If you feel it isn t enough, consider buying a lighter gel-based moisturizer to use after the serum and before the tretinoin. Leave the heavier Cerave moisturizing cream for after the treinoin only. Eventually, you can turn to other treatments and serums to target your concerns. Hope this helps!",1,True
1gine10,"My current routine AM 1. CeraVe Renewing SA Cleanser 2. OXY 10 Lotion 10 Benzoyl Peroxide 3. CeraVe AM Facial Moisturizing Lotion PM 1. CeraVe Renewing SA Cleanser 2. DIFFERIN Adaplene Gel 0.1 Retinoid 3. CeraVe PM Facial Moisturizing Lotion My problem My face has a lot of dark spots caused by previous acne scars. I ve seen online that Vitamin C serum could help with those blemishes and so I ve decided to give it a shot. Problem is, the Benzoyl Peroxide and Adaplene Gel in my routine supposedly counteracts the effects of Vitamin C serum. What I d like to know is if there s anything in my routine I could change to add Vitamin C serum in it.",1,True
1gicgsy,"i don t know much about niacinamide and dry skin, but i really liked the Good Molecules Niacinamide Brightening Toner in the morning to make my skin brighter! i have also tired the cerave hydrating cleanser and thought it was nice",1,True
1ghyvrw,"aww, my tj maxx is stocked with themm, there is like 3 rows of cerave, wish I could give you one",2,True
1ghyvrw,"Nah don t listen to them, it s bullshit. Fearmongering about chemicals. It s literally because it contains propylparaben which is a highly effective preservative that is demonized by natural or clean beauty for no factual reason. These brands will choose not to use preservatives bc they re toxic and then their buyers wonder why their stuff turns rancid. Most of the fearmongering is based on a flawed study in 2004 that is constantly cited despite not proving any causation. The gist was that their samples of breast cancer tissue contained parabens, but they literally never even compared it to healthy tissue, which could have also contained and showed that there s no link between the two. The study also didnt detail all the possible causes of how the parabens were introduced in the first place. Additionally, the blank samples containing no tissue in their studies had higher levels of parabens than the cancer tissue. There are clear guidelines of what level of certain ingredients are considered safe. There have been multiple studies since showing even if you used a ridiculous amount of it every single day in multiple products at the highest allowed concentration, you d still have used tens of thousands of times less than the level that is considered still safe. The estrogenic activity of parabens is thousands of times less than estrogen. There s a reason why cerave is generally stocked and recommended by dermatologists - because it is safe and mild to work for almost everyone though every one s skin is different of course .",9,True
1ghnb98,"I would speak to your practitioner regarding your birth control. It sounds like the acne has occurred due to being put on birth control, especially if you ve previously taken it and had no issues. Hormones play a huge part when it comes to our skin. I would recommend using the cerave sensitive face wash and using a salicylic acid serum to help with the active acne. Go in with a good hydrating moisturiser and make sure you don t forget spf50.",1,True
1gh0lmu,"Why are you using both a salicylic acid cleanser and salicylic acid serum, and why are you using them on the same day? When did you stop using the CeraVe? The CeraVe moisturising cream caused me closed comedones, but they take a while to go away even after you stop. The current routine looks pretty good. How long have you used it? I didn t have cystic acne but retinol helped my comedonal acne a lot, you could try increasing how often you use it. Once a week first, then maybe on Monday and Friday, if your skin feels good you can do MWF. If you have any irritation, redness, stinging, burning, flaking, dryness, it s too much, don t use it until your skin feels good again and then go back to how often you used it before. If you get irritation, you won t get the benefits.",2,True
1gh0lmu,"I did stop cerave cause i think it s the one that caused me those bumps, i feel like it s heavy",1,True
1gh0lmu,"Hello! Like for a couple of months I used salicylic acid cleanser before i realised that i over exfoliate my face. And from September 15-31 i simplify my skincare to heal my skin barrier cleanse, moisturizer, sunscreen . And October 1st up to now i start to introduce active ingredients. And i stop cerave right after i simplify my routine, also when i simplify my routine i already have closed comedones. As far as i remember, this year march-june i have retinol in my routine and stopped it, just resumed last October. Using it doesn t irritate my skin. Now i want to rest my face again from actives but i doubt my skin barrier is damaged because it s just been a month with a balance routine I have, i don t know if my barrier is damaged again. downcast_face_with_sweat Or just continue my current skincare?",1,True
1ggv76r,"In the morning you should apply moisturizer and a sunscreen. I would also recommend a vitamin c with THD if you have sensitive skin. Don t use the 2 BHA at the same time as the glycolic toner. Same with the salicylic acid cleanser. You don t need all of these actives. And don t use any of those on nights you use tretinoin. Always use moisturizer every day and night. I recommend a gentle cleanser, for the acne, these clarify pads from AziMD work so well for me, and then moisturize. I like that brand s intense recovery moisturizer but if it s too expensive, just use cerave or something else like that. Honestly, those are the things. AM Cleanse or rinse Clarifying pads Moisturizer SPF Night Cleanse Tretinoin as instructed nights you can use those pads again when you don t use tret Moisturize",2,True
1ggtz5w,"You might want to first try just upping the moisture occlusives at night, and doing some sort of physical exfoliation in the morning when you wear makeup. I have the same problem with retinoids, and that has helped me immensely. I use Klairs Supple Prep as a hyaluronic toner first add a layer of my retinoid apply rosehip oil to my trouble flaky spots after, then layer on CeraVe cream. If I m still having problems, I ll use LaRoche Cicabalm on top you could sub Vaseline . Then in the morning, if I m wearing makeup, I ll use Trader Joe s micro dermabrasion scrub, wash with CeraVe, and follow with the Klairs, Vanicream, and a silicone-based primer. The other thing is maybe you should cut back to just a few days a week? My skin is so sensitive that I stopped using it for a year. But I m working back up to using it every other night I read about this 4 day pattern. It s suggested first night you exfoliate I use The Ordinary Lactic 10 , second you use a retinoid like above and the third and fourth you treat as recovery days--abstaining from any actives though I use my diy combo of powdered Vitamin C, The Ordinary Ferulic E, and Hada Labo Gokujyn Premium the gold bottle . The first day of exfoliation primes the skin to absorb the retinoids, and the 3rd and 4th day let your skin recover from the actives the other two days. Byrdie et al have articles citing dermatologists the regimen has worked really well for me--Vitamin C gives an instant glow, so I really want to keep incorporating it. GL!",2,True
1ggl6u5,"Salicylic acid isn t that strong so your moisturizers should be fine. Maybe don t use it every day, 1-2 times a week at first. Snail mucin isn t a moisturizer so that won t help. It just slightly hydrates. You can use it with Cerave.",3,True
1ggl6u5,"Oh, my bad. Snail 92 is a moisturizer, 96 is more of a toner. Still, I wouldn t add too many new products and Cerave would be similar.",2,True
1ggdwpl,Ph balance is everything best oh to control sebum is 6.0 cerave foaming face wash has a ph of 6.0 and glycerin don t use moisturizers unless the ph is 6,1,True
1ggcgpj,"I got it online from shopee singapore, but its not from the cerave official store, its a reseller.",1,True
1gm1sdf,cerave products broke me out HORRIBLY,5,True
1gm1sdf,that s crazy! cerave broke me out and la roche is the only thing that would clear it up smiling_face_with_tear,4,True
1gm1sdf,"Throw out the magnifying mirror. That s literally just looking trouble! Unless you need that thing for putting in contact lenses, you don t need it. Noone should ever have to see their pores like that! If you re using some of this on your body, fair enough. There shouldn t be much harm in that. Here s how I would wiggle this routine around Am a gentle cleanser - the vitamin c OR the control gel - day cream SPF Pm gentle cleanser - retinol OR the exfoliating treatment - a heavy night cream if you like cerave I d rate there moisturising lotion or cream",2,True
1gm1sdf,"My bf works for L Oral so I have all the cerave goods but we re not renewing lease at the end of the year hence why I took the opportunity to buy all this stuff for the inevitable limited supply once I leave. But okay, that s a good routine but then when should I incorporate the other ones I have? Are the moisturizer creams I bought also too harsh or can I start using the night one and eventually once my SPF moisturizer finished then I can start using these wrinkle expert or hydra renewal ones? I also was given a little box of skinceuticals HA intensifier multiglycan that I haven t touched at all and would actually prefer to give it to someone or sell it since I doubt I ll use it because idk what I m doing. weary_face",1,True
1glrvem,Isn t it simpler to message Cerave on their Facebook page with your photo and get an actual legit reply faster?,20,True
1glrvem,I think some of the CeraVe products have phthalates which have been linked to hormone disruption and reproductive problems,1,True
1gl9061,"Hey good sir if you like the CeraVe foaming cleanser than keep using it, however, foaming cleaners can be drying. A common situation with oily skin is lack of hydration. That s why your skin is creating so much oil, it feels dry and dehydrated. Perhaps you can find a balancing, oil free cleanser that is both cleansing and hydrating. Next you ll want to follow with a toner. Perhaps with salicylic acid to cut through the oil. You don t need to use this every day. Perhaps 2-3 times a week. You ll need to invest in a medical-grade vitamin C. Vitamin C is hella unstable and needs to be stabilized to be effective. You ll use Vitamin C every single morning. Following that you can incorporate a hyaluronic acid serum for internal hydration. Next you ll follow with a moisturizer if you feel your skin needs it. Next is non-negotiable and it s sunscreen. You ll also want to incorporate a retinol to get your skin exfoliating internally, similar to how chemical exfoliants like, salicylic acid, exfoliate externally. The retinol as well should really, really be medical-grade.",2,True
1gl2j67,"Actually you may be on to something here I don t have vitamin B on any of the products I use except for this one, but my cerave acne gel has glycolic acid and it s a great product for my skin so it actually might be the vitamin B causing all my breakouts",1,True
1gk2a4d,"I have it and I love it! After it I usually use the CeraVe lotion for normal to dry skin and my skin has been looking really good. Generally, all of the CeraVe products I ve tried suited my skin, you can t go wrong with them.",1,True
1gk2a4d,"I must try this, I love CeraVe products as they ve literally changed my skin. folded_hands for the recommendation",1,True
1gjqnp9,I use knockoff brand equate or life of the cream cleanser. It s the same formula as the OLD Cerave cream cleanser from years ago before the changed the formula. I feel like most people don t know they changed the formula. Ofc. Shrinkflation.,1,True
1gjqnp9,"I really like the new cerave foaming oil cleanser, it very gentle and non stripping.",1,True
1gjlpaw,"Looks like you have a lot of people helping you here but I m just here to contribute my two cents which is that Cerave moisturizer gives me horrible acne and if I were you, I would just try the do nothing method for a couple of weeks to see if the products are making it worse. Then rebuild a routine from there. Accutane has a ton of risks and it doesn t look like like you have deep cystic acne so I d try to exhaust all topical options first. It looks like very inflamed pustular acne to me which is the kind I personally get from Cerave moisturizers .",17,True
1gjlpaw,"So firstly remember that consistency and patience is key especially when it comes to acne. Using a product for just a few days doesn t give it enough time to work and it may take some time to see results. So you may want to revisit benzoyl peroxide or other over the counter products with consistency. If you return to a dermatologist, try to stay consistent with any topicals or anything else they give you. Then if you don t see results after that you are definitely a candidate for Accutane. The next thing I ll point out is the things that can really impact acne that are easily overlooked, like 1. Washing your sheets and pillowcases AT LEAST once a week. 2. Drying face after cleansing with a clean towel. 3. Not touching your face. 3. Cleansing immediately after working out or lots of sweating. 4. Using gentle products that won t aggravate active pimples. If I were you I would start by washing at night with a 10 benzoyl peroxide wash, moisturize after cleansing, and incorporate a sunscreen in the morning. If you want to wash your face in the morning use a gentle cleanser like the CeraVe you have. Then I would get another appointment with a dermatologist and stay consistent with what they give you. They should set up a follow up and if you aren t seeing results even after using the products for a few months, push for an Accutane prescription.",4,True
1gjlpaw,"My derm didn t want to give me accutane despite my desperation either. Best advice I have is to stick to the routine even when it feels like it s not working, because it can take months to come out on the other side. Im allergic to benzoyl peroxide, sacylic acid ruins my face, I have had many breakouts just from lotions. Has your derm tried antibiotics and tret? I agree with the others with taking a probiotic. Prescriptions that worked for me- doxycycline, sodium sulfectamide sulfer wash, Clindamycin gel, tret .05 and for a while I was using dapsone gel along with all of it. It was quite a battle but I have been clear for a while and am down to just the wash and tret. I still use clindamycin as spot treatment now and then. Cerave was the worst lotion I used and caused cystic acne on my face. I stick to gel type moisturizers. One that is good for oily skin type is lrp double repair MATTE moisturizer. It does contain niacinamide in it which could help too. Good luck!",3,True
1gjlpaw,"I also struggled with acne for a long time until I was 27 or so, not much different than this. A couple things finally helped me after trying almost everything under the sun for years. 1 La-Roche Posay Effaclar Duo 2 Adapalene 3 Prioritizing moisture Every night oil cleanse your face we ll get to why you need to oil cleanse in a sec , then apply the LRP and Adapalene. Then make sure to moisturize with something heavy like Cerave s healing ointment. In the morning, rinse your face with water, no need to wash, and apply an SPF. The SPF is why you need to oil cleanse at night. Change your pillow case and do your routine every night without fail. Ease into using the products and let your skin get used to it. Maybe start 1 night on, 3 nights off, and work up to every night. On the nights you aren t using the products you still need to moisturize and oil cleanse, and you still need to wear sunscreen every morning. Also get some excercise and plenty of water and eat healthy foods. If you use hair products find a way to prevent it from getting on your pillow in your sleep.",2,True
1gjlpaw,"Cerave moisturizer may be the culprit. The cerave pm gave me an uncontrollable breakout. But aside from that, I think you should visit a derm. They can prescribe tret or tazorac to help clear this up.",2,True
1gjlpaw,"Tretinoin my man. Tretinoin. Also ditch cerave, go with vanicream. Cerave is notorious for breaking people out.",2,True
1gfsnyp,"If you are already using a Cerave cleanser, why don t you simply follow it up with a Cerave moisturizer? They work together beautifully. I can t imagine that you would have a bad reaction. Cerave products are great",1,True
1gfsnyp,"You always want to follow with moisturizer after a cleanser, even when starting a new routine. Cleansers typically don t break people out unless they re allergic or it has an active like an acid in it that s damaging the skin barrier. I would try using the cerave oil to foam cleanser though if you have dry skin. I find the hydrating one to not clean very well, and sometimes burn when my skin is sensitive could be just me though . If you want to try the Bha, use on clean dry skin and only 1-2 times a week to start and always follow with a moisturizer. Bha s are known to cause skin purging breakouts so be aware that that might happen. I would actually advise using the Paula s choice mandelic acid over the bha since it s much gentler. Bha may be too strong to use for first time using acids.",1,True
1gfsnyp,"i was reading a lot about the Cerave moisturizer on here other skincare subs and a lot of people experienced breakouts and comedones, so i tried to avoid it honestly, i get anxiety with too many options so once i read that i was like no thanks, and moved on lol",2,True
1gfsnyp,"Seems to me, you ve already skin tested Cerave by using the cleanser. If anything, I would stick with the brand your skin knows. Less anxiety than switching brands, IMO",1,True
1gf3opo,"Stop the Dr bronners soap and switch to a gentle cleanser like cerave daily foaming face wash. Use the cerave SA cleanser 2-3 times a week in the pm. Other wise use the daily foaming wash . Keep up with the double cleansing in the PM. You could have a disrupted skin barrier and I agree to cut back on the SA toner to maybe a few times a week. If you start using Differin gel, then stop the SA toner. Start with using the Differin gel a few times a week in the PM after cleansing and follow with a moisturizer. Once your skin adjusts you can start increasing frequency of use, to eventually get to using it nightly. For the AM I think a product containing azelaic acid could be really beneficial since it gently exfoliates while also being antibacterial, so it s great at treating and preventing acne. Just be sure to follow with your moisturizer and a good SPF.",3,True
1gal6dh,Maybe the CeraVe moisturizer with SPF? I also like Laneige,1,True
1gafxxg,Cerave helped me a lot for my acne,1,True
