post_id,body,score,contains_term
1gmkh7d,"I remember when I used cerave products couple years ago, especially after that cleanser, I got those bumps mostly on my forehead, and when I stopped using it, they did went away folded_hands_light_skin_tone that cleanser is sooo harsh actually. never again!",1,True
1gkk58i,"I would slowly introduce products into your routine and keep to the basics. - The first one is a Hyaluronic Acid serum which will help with dryness. It works and isn t pricey. I heard good things about the Ordinary HA. - Then, a vitamin C helps with brightening and dark spots. Vitamin C products are tricky because Vitamin C is an unstable ingredient so you would want to look around a bit. I personally use Vit C from Murad, Sunday Riley Educated Mess. - Retinol, which is Vitamin A, helps increase skin cell turnover and reduce fine lines, dark spots, and acnes. I used to use La Roche Posay but I now use Tretinoin which is the prescription strength of Retinol. Many online services offer Tretinoin these days so you don t need to go to a doctor office for it. - Moisturizer with peptides can help with fine lines and skin barrier. Inkey, CeraVe can be good starting points. - Sunscreen. I use Korean sunscreens from Skin1004 Beauty of Joseon. For American sunscreen, EltaMD is highly recommended. I used it for a while when I was dealing with acnes. Since your skin is dry, I would switch to washing with a hydrating face wash instead like CeraVe.",2,True
1giam4n,"Dove soap, cerave moisturiser and 0.05 Tret! I posted my routine in another sub.",2,True
1giam4n,I used cetaphil too if not cerave,1,True
1glaoaq,Probably the spf. SPF sits on the skin and doesn t sink in You could try less layers but it may still happen. Idk that an spf would sit well on a thick cream like cerave. But maybe you put a thin layer idk,3,True
1gl3pxw,Not sure of the price in the UK but The Ordinary retinal is decent. It s much stronger than Cerave retinol but worth the effort.,2,True
1ghuhh0,"Cerave do another retinol specifically for fine lines and wrinkles. It s the Skin Renewing serum, in the purple bottle. It s a lovely cream serum. I really like it. But I d say it s more of a starter retinol. I ve heard great things about the Geek and Gorgeous A Game serum which is Retinal, if you re considering other budget friendly but potent alternatives.",2,True
1gf5m0c,"I d simplify your routine and keep it consistent. It s difficult to say for sure what the issue is without pictures but I wouldn t be surprised if this is related to skin barrier damage to due washing with shampoo. Also, some people get issues with Cerave products, especially their moisturiser as it tends to cause clogged pours. Take a break from using any actives for a few days then go with something like this AM - Wash just with water. Azelaic acid 10-15 , cetaphil light moisturiser. Sunscreen Skin1104 Centella sunscreen is a good choice for acne prone skin . PM - Cetaphil cleanser, retinol cerave resurface retinol is a good starter , cetaphil moisturiser. I d only exfoliate twice per week, I d swap out the cetaphil cleanser with a saliyic acid wash for those 2 days per week. Also, with the retinol, start twice per week and increase frequency every few weeks til you can tolerate nightly. Also, keep going with those diary changes, that will help.",2,True
1geupee,"37 yo male and just getting into the skincare thing as well nothing elaborate, just a very simple regime . I have just purchased the Cerave resurfacing retinol serum and have used it 4 times just starting with twice a week , so can t comment on effectiveness as I understand it takes months to see results, but I will say that the formula is nice and silky and goes on well and no issues with regards to dryness or irritation so far.",1,True
1geupee,"I use cerave hydrating cleanser in the shower, dry my face, use a pea size amount of retinol and then moisturise",1,True
1gcwg2l,"The best way to use it is to basically squeeze a blob onto wet hands, rub them together until a thinner paste is formed and use that on your face, then rinse off with more water. Double cleanse with your Cerave.",6,True
1g62mjv,"Hi I am currently using Epiduo and have had great results. I have oily skin which can be sensitive to actives. For me, introducing Epiduo was trial and error really, only using it when I thought my skin could handle it, this was anywhere from every day to every 3 days, building up slowly. My routine is fairly similar to yours, in that it is really basic. This is my routine when I first started, AM La Roche Posay Toleriane cleanser 1-2pumps massaged in for 60seconds removed with wash cloth cerave moisturising cream in tub quantity depended on how dry my skin was wait 10 mins Eucerin hydro 50 SPF 2 fingers PM La Roche Posay Toleriane cleanser 3-4pumps massaged in for 60seconds removed with wash cloth cerave moisturising cream in tub quantity depended on how dry my skin was wait until soaked in If Epiduo night I d apply it all over if my skin was particularly dry sensitive I would wait 30 mins and apply a small amount of la Roche posey cicaplast over the top. When my skin was tolerating Epiduo this way I alternated between applying Epiduo first and moisturising first. when using Epiduo first I apply a small amount of moisturiser first to around my eyes moisturiser goggles Dr Sam calls it . There was no strict routine to it, I just learned when my skin could handle Epiduo directly, when it needed a buffer and when I needed a night off from it. When my skin was tolerating Epiduo well and I was using it before moisturising, before moisturising I would use the mighty spot patches on any big spots that had come to a head. When I did this and I was still getting red from Epiduo I ended up with a slight ring around the patch where the patch appeared to reduce the redness There are a few things you can consider How much Epiduo are you using on your chin? If you are using the full pump, you ll be using too much. I put equal dots of it on each cheek, nose, forehead and chin before rubbing in. It could also be that Epiduo just isn t right for you, you could try adapalene and BP separately Acnecide and Differin and introduce them slowly You could try contact therapy which seems to work for some people who can t tolerate actives well I don t know too much about it It could be that neither are the right treatment for you",2,True
1g4fefq,"a before photo would have been nice, but i ll work with what we ve got. as the cerave resurfacing serum is technichally an exfoliant, purging is basically expected. unfortunately, purging and breaking out in skincare is difficult to tell. i expect that it would be purging and not breaking out, but continue to use it a little more. if you don t see improvements or they get worse then ditch it, it is breaking you out. a rule of thumb for skin purging vs breaking out is working out which products affect skin turnover. these ones are likely to purge, but could also still break you out. this includes vitamin a what you ve got , vitamin c, benzoyl peroxide, exfoliants, etc. but products that don t affect skin turnover, so things like moisturisers, sun creams, and cleansers don t cause skin purging unless one has ingredients in it that affect skin turnover . so if those do break you out, ditch it.",2,True
1g3fnvd,You can get it on amazon but make sure you buy from the Cerave store as there s a lot of fakes out there. The store does mark up the price. I found La Roche cicaplast a better alternative.,1,True
1g3fnvd,I ve had this same question for weeks like you love the Am pm but the pm is not thick enough and the tubs chalky and as you say no Niacinamide. I contacted cerave uk and enquired but they said no plans to stock it yet in uk and ireland,1,True
1g3fnvd,"So I have ordered a couple of pots from Amazon US .com site , absolutely ensuring that it is the sold by Amazon version and not some dodgy third party seller. Should be here in a couple of weeks to try! I m only just getting into a basic skincare routine and have realised my skin is dry and cerave really works nicely on it.",2,True
1g3fnvd,It s a good solid cream I really like cerave . you will have to let us know how it goes .I did look at the US site but got confused so you got further than me but I m dying to try it as I hear such good reviews never a bad word that and timeless vitamin c which also can t get here.,1,True
1g3fnvd,They arrived today. I ve checked all the packaging and compared to the Cerave site and everything lines up and is correct. The label is not quite perfectly straight is the only issue I can find but this happens on legit products as well. Hopefully they are real!,2,True
1g3fnvd,I just worry that I wouldn t know the difference as i ve not used a genuine one to know that i m using a fake and i ve had a Am cerave and vitamin c serum that were fakes but I was suspicious straight away .,1,True
1g3fnvd,"I looked at them a few times and it was working out at about just over 20 a pot I couldn t postage and VAT. However, Amazon were having a buy one get one half price offer so I picked up 4 for 60 including postage and packaging. 15 a pot doesn t seem too bad for the ingredient list. Just hope that my skin likes it now, but generally Cerave products work nicely for me so not too many concerns. Will finish off my current cream and then try.",2,True
1g3fnvd,"Amazon. I got a refund both times but it really annoys me people are paying to put some unknown substance on their face body I can t believe they the supplier get away with it and I m paranoid now about buying skincare online but boots doesn t stock everything. On another note have a look at the Dermatica Nourishing Moisturiser it s sold on Amazon but by Dermatica so no fakes. It s got everything cerimides, peptides, niacinamide etc .comes in a pump tube so very hygienic and cost the same as a cerave pm lotion.",1,True
1g2xu6q,"I dont like cerave, personally find it to drying. Im using e45 face wash, and highly rate euracin urea repair face cream. Red light led is also very good of you use it regularly. Think you need to probably try a few things until you get what works for you.",2,True
1g2xu6q,Difficult to tell from the picture but some areas look like a damaged skin barrier. Which Cerave cleanser are you using?,1,True
1g220nr,"I ve tried using it without the CeraVe lotion before and it made my skin more dry, so I m worried that will be the same with the zeroderm",0,True
1fz9a8i,"As budget is an issue, just choose a moisturiser meant for regular to dry skin. Guessing Cerave is for oily and wouldn t moisturise enough.",1,True
1fz9a8i,"Oh I do, sorry I should ve mentioned that. I also use cerave moisturising cream which I was already using prior to tret , Cicaplast was added to the routine post tret and solved most of the issues tret caused.",1,True
1fxnt5h,"Wait the Cerave is. 3 ? Goddamnit I just ordered tret at. 25 thinking it was a step up from my Cerave, I didn t realise it was a decent percentage. Aghhh",1,True
1fxnt5h,"Tret and retinol aren t the same. Retinol is sold OTC, because it s a cosmetic derivative of the prescription drug that is Tretinoin. So Cerave s 0.3 retinol is nowhere near as strong as tret at 0.025 . You re using the strong stuff and that s just the lowest percentage you get tret at. I wouldn t worry about the Cerave if you ve got tret. Although, be careful and start slowly as always with tret.",4,True
1fv7bft,I use a HA serum on damp skin and follow it up with cerave moisturising cream. At night I do the same but I use Nivea cream for slugging after. Does the job for my eczema prone skin quite nicely,4,True
1fv7bft,"I moved to a very dry climate and I tried everything but my skin was always flaky. This is my current night skincare routine that is working, I wake up and my skin feels super hydrated - Any cleansing balm currently using clinique - Gentle cleanser currently using avene - YTTP hydrating mist great for sensitive skin or you can use avene thermal water spray - Byoma hydrating toner 2-3 layers, this makes a huge difference - hyaluronic acid serum on damp skin currently using good molecules - any other serum on rotation - eye cream Kiehls avocado cream or Biossance - thick moisturizer with face still slightly damp I like Cetaphil healthy renew, cerave skin renewing night cream, Tatcha dewy skin cream, Biossance gel moisturizer - I wait a couple of minutes and use tretinoin if my skin is not irritated. - if I feel I need more hydration or my skin is irritated I use a small amount of avene cicaplast on top.",3,True
1fv7bft,"Hyaluronic acid on damp skin, cerave in the tub, Avene cicalfalte on top. Go to bed super greasy but works like a charm I m on accutane and often don t need the Avene at all!",2,True
1fv63fp,"I used to get a lot of stuff like this, now I never. What I put it down to was I was using too much stuff on my face and my pours were getting blocked. Cleansing it daily, then using quite heavy moisturisers. I think especially being a male that doesn t wear makeup, I don t need to do all this cleansing and other stuff So what I do now is rinse my face with cold water only once in the morning and once at night and use oil-free gel style moisturiser Facetheory super gel or Curel oil control weightless gel moisturiser . The water only wash is just a gentle way to rinse my face. No need to wash with anything harsh since my face generally doesn t get dirty nor do I wear makeup. So since my face isn t getting stripped too much, a lightweight gel moisturiser is fine. I might on the odd night use Cerave blemish control gel moisturiser with 2 salicylic acid, just as a measure to keep my pours unlocked Also, try shaving with a safety razor if you don t already. I find it s much gentler on my skin compared to a normal cartridge razor",1,True
1fpde7g,Its so tough feeling rubbish about your skin. Are you not moisturising at night? Lather on something like cerave cream not the lotion to repair the skin. Roaccutane is a really harsh treatment.,3,True
1fpde7g,"Thank you for your very generous reply! I ve just been in the USA for the first time and in NyC everyone had such perfect, glowing skin, it made me feel so haggard. I didn t make it clear in the post that if it s the PM I do try to use Cerave in the tub every day, but my routine is not concrete thanks ADHD",2,True
1faags7,"I m sorry to hear you re going through cancer. I finished chemo earlier in the year. I already have sensitive skin so all my skin care has to be perfume free, for example. I ended up using cerave spf 25 50 moisturiser and carried on using lancome genifique serum. I gave up retinol. I ended up using emollient cream for washing as I couldn t tolerate much more. And I didn t have the energy to try lots of different things. Strangely enough, despite feeling like I wanted to die, my skin looked really nice. Look Good Feel Better offer courses on skin care, amke up etc. I can really recommend them. If you are likely to lose your hair then there are other charities that help with that. Please DM me if you want more info.",2,True
1f9vmpt,"It s difficult to tell from the pictures alone but some areas look like you have a damaged skin barrier. I d cut out the Cerave SA cleanser for now as a lot of people get a damaged barrier from using this daily. Go with a simple routine, this worked for me AM Cetaphil gentle cleanser You can skip washing with a cleanser in the morning and just wash with water if you skin is feeling irritated Azelaic acid 10-15 Cetaphil gentle moisturiser SPF50 I use Skin1004 PM Cetaphil gentle cleanser 2-3 x week swap this out with Cerave blemish control wash Azelaic acid 10-15 Cetaphil gentle moisturiser This is a simple routine, worked for me to keep acne under control. When you re ready, you can introduce a gentle retinol at night, the Cerave resurfacing retinol is a good starter retinol.",4,True
1f9vmpt,Benzoyl peroxide and wash pillowcase Like Cerave acne foaming wash and Neutrogena spot treatments and moisturizer,2,True
1f7cc22,"Aveeno Calm Restore Nourishing Oat Cleanser is one of my faves. If you want something foaming, the Cerave Hydrating Foaming Oil Cleanser is also quite nice.",1,True
1f0ycu4,The SPFs I use are moisturising enough on their own to be honest. I just use the CeraVe SPF50,1,True
1eys00g,You can t tell from reviews whether something will cause closed comedones. It will for some people and it won t for others. And people often misattribute these things to their products anyway. If the Cerave is working well for you so far there s no reason to change it.,4,True
1eys00g,"Try the cerave foaming, it s much better suited for oily or combo skin",2,True
1eys00g,Would recommend cerave face washes,2,True
1ewrdvp,"Please make sure you incorporate a sunscreen in your routine as well since you re using salicylic acid. What helped me personally with SF is doing an oil cleanse in the evening, followed by my normal cleanser. I use pure jojoba oil and massage it for a couple of minutes on dry skin, wash my face with water and then lastly apply a cleanser to wash off the oil I also have the cerave one . There are plenty of decent oil and balm cleansers on the market.",3,True
1epwwce,"When I was struggling w acne, I only used The Ordinary s niacinamide and salicylic acid. Cleanser I used Cerave salicylic acid cleanser. Those three kicked my acne really hard.",1,True
1epwwce,"I should ve said it more clearly but it s been over a year since I started using the Cerave retinol and have almost none left. I have stuck to the same routine for almost half a year and to be fair my skin does look a lot better despite my acne not improving. However, I will probably cut down on some of the stuff I use.",1,True
1ehyffv,This is my skin right now. I ve not applied anything other than washed it with cerave foaming cleanser.,1,True
1ec33pm,"I used to use the Cerave cleansers for years and felt so frustrated because my skin looked dull or got miles worse SA cleanser especially made me so dry and ive never had dry skin before! - something that really put it into perspective if youre washing your face twice a day with it, that s 14 chemical exfoliants a week! Now I just use the basic Cetaphil oily skin cleanser Simple Triple protection moisturiser so very basic products that allow my actives to go to work. I m getting into retinol in a big way now and have noticed SUCH a huge improvement in my skin since starting it without any negative effects. Just recently introduced azelaic acid which touch wood seems to be doing wonders for red patches uneven skin tone too so now I ve just down to sorting hormonal cystic acne - only warning for AA is that for me it had made certain patches dry but nothing my moisturiser hasn t tackled",1,True
1dyjduu,Use a gentler non-exfoliating cleanser instead. I really like the Cerave foaming oil cleanser. As for which moisturiser? It s pretty much just trial and error to find one that works well for you. I m currently using this one. It s a bit lighter than the Cerave cream and it sinks in easier. Try not to judge yourself so harshly immediately after washing. I find that no matter how gentle the cleanser my skin always looks a bit more inflamed than usual for an hour or two after washing. It almost always looks better the next morning when it s calmed down a bit.,1,True
1dqg9yx,"Coming from someone who had bad acne for years and years Lifestyle 1 Cut out sugary products and milk products do one first and the other one like two weeks later to see the difference 2 Retinol or other stronger derivitives specifically for acne from dermatologist . I use over the counter CeraVe retinol. 3 Foaming cleanser or more specifically cleanser with Salicylic Acid. For example CeraVe Acne Blemish Control. 4 Moisturizer. Yes, I know, it sounds like it would make it worse but trust me, you still want your face to be moisturized. Non comedonic ones. Final option 5 Your skin is actually not that bad and I think the above two would help alot but if it still doesn t go away then Accutane. Accutane was the only thing that really helped me to get rid of 99 of my acne. I was on it two times actually as a year after the first time half of my acne came back. Now after Accutane I maintain my skin with the first four steps. Don t ignore the first point. I love sweets and cheese and cream so I refused to change my diet for years. but it really works for me. The moment I take a bite out of a chocolate, cheesy cake, icecream, etc. I break out within hours. So just try. Give it like a month.",2,True
1doiwe0,"I would take the sunscreen away from the nighttime routine. I would also add a hydrating moisturiser in both AM and PM routine and more hydration at night time. Your skin cells renew overnight and this is when it will benefit the most from hydration. I use ELF holy hydration moisturiser and it s really good and sinks in so well. I actually use the garnier rose water toner. It s so good and really good value for money. I also moved away from using Cerave cleanser every day as I felt it really dried my skin out. I use the blemish control one about twice a week now which I feel works for me! Also eye cream, just something hydrating will work. I ve had dark circles all my life and never got rid of them so hydrating is enough for me! I use byoma eye gel but I have the ELF one on standby for when that runs out!",1,True
1dm39fv,"It really depends on the persons skin type and how you tolerate exfoliants. Generally speaking, you d want to limit exfoliating to x2-3 per week. But Cerave SA washes off so in theory, it s not as harsh as using an SA leave on product. But if it works for you and you aren t getting any signs of skin barrier damage, I don t see a need to stop. For me personally, I only use it twice per week.",3,True
1dm39fv,"I got a touch sensitive on my cheeks after using it daily for about 6months. I ve switched to the Versed Blemish Calming Cream Cleanser which is slightly gentler in my experience and I can use it twice a day without sensitivity and it helps calm my acne down quite a lot. When I can t be arsed to use it for a day or two I end up getting a breakout shortly after so it really helps a lot for me. I ve been using the Versed for 8months now and no sensitivity Edit but it absolutely depends on what your skin can handle. Cerave SA might be perfect for your skin, you never know others could use it two days in a rough and go bright red.",1,True
1dm39fv,"If it doesn t hurt then it s fine. Just use some moisturizer afterwards. Everyone is different. I have naturally very acne prone skin. I was on Accutane twice. First for 8 months and then two years later for 9 months. Blood work perfect, skin dry but decent. My point is that I can throw a lot at my skin. Now I use CeraVe retinol and SA cleanser every day, works great.",1,True
1dckkau,"I ve read somewhere that Cerave cleansers have a toxic ingredient which is why I ve stopped using. Also, looking at the ingredients for Skinoren, there is isopropyl myristate which is known to worsen fungal acne. I ve always noticed if I use a product with this ingredient it causes some form of acne. It may be worth changing up your routine and ditching the idea of accepting the purging stage.",-1,True
1dckkau,"Yeah I ve figured out now that I function best on one clean a day, was just experimenting with the 2 I m not aware, does the texture of a cleanser matter? I assumed the fatty alcohols might be breaking me out, as the cerave in the tub and skinoren both contain fatty alcohols as does the cleanser",2,True
1dckkau,"Yeah my initial routine was just water in the mornings, and ive gone back to it now. My question is, if cerave in the tub, skinoren, and more cleanser use, all break me out, and they all contain fatty alcohols, is it likely that I m sensitive to them? Cus my skin was totally fine on this cleanser for like 6 months before the breakouts came back so idk",1,True
1dckkau,It be worth experimenting if you ve noticed connection. My skin absolutely can t take cerave cleanser or any foaming cleanser even once a day. I would try something a bit gentler and see if that works for you. If you re going down to cleansing once a day you might try using an oil based cleanser to wash off your make-up sunscreen and then following it up with a hydrating cleanser I love the simple range . Hope this helps!,1,True
1d6js32,"If you find your skin not very sensitive to actives, I can literally overnight with PC s 2 Salicylic acid, Cerave SA cream lactic acid, and two rounds of moisturizer massage in well and wait about half an hour for it to absorb, then go in again before bed on a clean pillowcase. Gone in maybe 2 days, 3-4 days to remove redness.",1,True
1d6js32,"I d get a tretinoin prescription you can use sites like Dermatica and Skin and Me - start slowly and build up use to most evenings a week if your skin can handle it. I d also work on the rest of your routine - a common misconception is that oily or acne-prone skin needs a foaming cleanser, but this can be drying and lead to more oil. So you can try using a more gentle cleanser like the hydrating one from CeraVe, or the hydrating cream-to-foam cleanser. In the evening, start with an oil cleanser to break down all oil, dirt, sunscreen etc. Make sure to keep your skin moisturised by using a moisturiser morning and evening. This is what I d recommend for your full routine Morning - CeraVe cleanser - Moisturiser on slightly damp skin - SPF Evening - Oil balm cleanser - CeraVe cleanser - Tretinoin - Moisturiser A couple of times a week you can use salicylic acid in the evening as it s oil soluble and will get deep into your pores. The Paula s Choice one is great, but there are more affordable options from the likes of The Ordinary.",1,True
