post_id,body,score,contains_term
1d6fq61,"Hey, thanks for the advice. I will definitely try that out - there is salicyclic acid in the Cerave SA cleanser but I assume a 2 serum to put on will be a lot stronger. Would you stop with the duac gel treatment for now then?",1,True
1d6fq61,"You can use both just not at the same time. The concentration in Cerave is much lower at 0.5 , it won t do much when on your skin for a few seconds anyway when cleansing. You need the proper salicylic acid at minimum at 2 . As said try it on one or two spots.",1,True
1d1tb5z,"Hey! I think you have closed comedones CC . To me, it could be your cleansing oil or your cerave moisturiser that could be exacerbating them. This means although you are adding in a BHA, the bumps will never disappear. Most of the time as I said CCs product induced but could be a little bit of fungal acne? I would reccommend and anti fungal cream or even just anti dandruff shampoo used as a face mask for a few days to see if they clear up? I have combo skin like you and found any type of straight up oil cleanser exacerbated my clogged pores. I use the ordinary squalane cleanser still an oil, but more of cream and simple face wash. As you are feeling a little dry, you may be stripping your skin too much during cleansing? I found that all the cerave cleansers did this to me and made me super oily but also very dry. If you don t wear SPF or makeup, you shouldn t need to double cleanse anyway. Have you considered adding in a retinoid instead of BHA? Cerave make a really nice beginner retinol serum which I think will help you too!",9,True
1d1tb5z,My skin loves the moisturising benefits from certain cerave products buttt it does unfortunately cause closed comodones on my skin. I think your cerave foaming cleanser is probably too harsh too. I find foaming cleansers to really deep clean but at the cost of stripping oils. Try another moisturiser and switch the foaming cleanser for a gentle cleanser from another brand. Remember to slowly introduce a new routine and give it a go for a few months before reassessing. You might purge before getting better as well.,9,True
1d1tb5z,Cerave products did this to me Still struggling to fix it tbh but cutting out Cerave helped a lot. I have similar skin to you,2,True
1d1tb5z,"Quit the DHC, which contains olive fruit oil and rosemary leaf oil. The niacinamide in the CeraVe looks like it s not doing you any favours either.",3,True
1d1tb5z,"Omg thank you so much! I really love CeraVe products, so its heartbreaking that they could be causing it! I think theyre definitely causing the dryness, I ve tried loads of them and had the same issue no matter what, the moisturiser doesnt seem to help at all. Ill definitely try the Ordinary products and a Simple face wash. I have Head Shoulders face_with_tears_of_joy would that work as a face mask do you think? If not I ll see if I can find an anti-fungal cream online somewhere or in a shop near me. I was eyeing up the retinol serum already! I ll start with taking my routine back to basics and add stuff in after a few weeks as I go. Thank you so so much!",3,True
1cz4003,"The EnvyU Skincare cleansing bars have literally changed my skin. My skin has been so oily and spotty for the past couple of years and neither the CeraVe cleaners for oily skin or blemish control made any difference so I was getting a bit desperate. I tried EnvyU after seeing loads of good reviews on Instagram, and even though you need to get it shipped from the US I was desperate enough to try. I can t quite believe the difference they ve made to my skin, my face is so soft, blemish free and the oil has reduced so much! I don t wake up with oily skin anymore and I don t have a ridiculously shiny face after a day at work I was blotting my face on paper towels too! . I would recommend this brand to anyone, I will never go back!",0,True
1cvasgo,"Firstly well done on getting this far and I wish you every success in getting your health back to a place where you feel healthy and happy in your own skin. You ve got some decent products in your arsenal there that will definitely help to get your skin back to good health. Focusing on the basics will give you a great foundation and something to fall back on if some days are too hard to do all the things. I m concious you have a lot of exfoliating products in there - try not to fall into the trap of over exfoliating as this can cause dry skin and might even damage your skin barrier. Especially as you have a retinol in there as well which can also be drying. If it was me I d alternate between the exfoliating acids and the retinol to mitigate this. The cleansers I m not as much concerned about as you wash them off. A weekly routine could look like this AM day 1 Cerave foaming cleanser C C blackhead toner E45 moisturiser and or SPF depending on the SPF PM day 1 Charcoal mild exfoliating cleanser retinol E45 AM day 2 Cerave foaming cleanser C C blackhead toner E45 moisturiser and or SPF depending on the SPF PM day 2 Cerave foaming cleanser TO Glycolic Acid - leave for 30 mins - E45 Day 3 same as day 1. Day 4 same as day 2. Day 5 same as day 1. Day 6 same as day 2 Day 7 same in the morning - PM use foaming cleanser and finish off with the salicylic face mask. Here s where you can use a nice hydrating sheet mask afterwards as a treat or bask your skin with a thin layer of zinc cream like sudacrem. Wirth regard to the SPF its personal preference - use 30 SPF in the summer months, just find one that you like, doesn t sting the eyes and feels comfortable on your skin. Edited to add - if your blackheads cysts are causing you the most concern, maybe look to get an extraction facial rather than a hydrating one? This might be a better solution for you at this stage of your skincare journey. Good luck and I wish you well",1,True
1cvasgo,"Start slow and simple, get used to doing a routine, then work your way up from there I would start with the CeraVe cleanser morning and evening, followed by the E45 moisturiser. In the morning, followed with SPF - if you want an affordable one that s easy to find, Nivea do some good facial sunscreens. Once this has become a habit, you can add your Dermatica treatment a couple of times a week in the evening, and exfoliate once a week. See how your skin reacts and you can increase decrease the number of days a week you use actives as required. Hope this helps!",1,True
1cqc80w,My daughter uses a lot of Acnecide and Purifide. She uses the Acnecide Face Wash most mornings in the bath but will use the Purifide blackhead scrub twice a week beforehand. She uses the Purifide cleanser at night and will then apply the Acnecide leave on gel overnight. It took 3 or 4 weeks to show only results but it s the only brand that has helped her and now if she goes without for a few days usually when we run out of the tiny tube of gel it will get worse. I found Cerave absolutely useless for the most part but she does use the SA moisturiser. The regular hydrating one stung her. Give the Acnecide time to see if it works,2,True
1cncq1c,"I bought the CeraVe hydrating cream-to-foam cleanser as it says it removes make-up and I wanted something that d remove my suncream at the end of the day. I m not sure about how well it removes make-up I don t wear any , but it definitely gets rid of my suncream and doesn t dry my skin out horribly",2,True
1cncq1c,"thank you 3 I have heard mixed feelings about cerave loudly_crying_face I just feel like I m not doing enough, and my brain I m autistic wants it to be perfect and done so it can be part of my routine I can do it forever. but everyone recommends smth different, and it s usually inaccessible, expensive brands loudly_crying_face",2,True
1cncq1c,"Oh I completely understand also autistic , I just read about CeraVe a few years ago and stuck with it lol. Over the years I tried so many different things trying to find the key to clear skin was bullied since age 7 through to secondary school for what I consider to be mild acne , and I ve finally managed to force myself to stop getting all of the trendy skincare ingredients. Niacinamide breaks me out, a vitamin c serum caused mega irritation my own fault, my barrier was damaged from overusing Epiduo Forte , micellar water makes my skin feel gross etc. Being an obsessive face skin picker certainly doesn t help lmao. I really hope you find a make-up remover that works for you red_heart",2,True
1cnafhs,"In what way is your skin sensitive? If your skin is easily irritated and dry, and doesn t mind oily lotions, I d recommend the Eucerin Ato Control face care cream The CeraVe moisturising lotion would set my face on fire when my skin was acting up thanks to Epiduo Forte red_heart , but the Ato Control cream doesn t cause any burning stinging for me. I ve noticed that since I started using it daily, my skin doesn t get upset anywhere near as frequently as it used to, even when I use the Epiduo more than my usual 3 times a week. It s a bit pricey for such a small bottle but it has lasted me about three months of daily use, and at the moment there s a 3 for 2 on Eucerin products at Boots so it s a bit easier to justify lol",6,True
1cm774s,"Congratulations! I too have PCOS with a spotty jaw and am 8 weeks pregnant, desperately awaiting my pregnancy skin glow up. Personally I would get something that cleanses a bit better than just micellar water for the evening. Perhaps adding a basic hydrating foaming cleanser to your routine either a Cerave branded one or Simple. For the spots, benzoyl peroxide gel sold branded as Acnecide over the counter is safe during pregnancy. I apply it to clean skin over the entire area affected using a cotton pad or bud it s notorious for bleaching fabric . Wait until it dries and then carry on with the rest of my routine as normal. Make sure you wash your hands afterwards. Like retinoids it increases the skin turnover and also kills the acne bacteria. It can be drying on your skin so you may wish to start out applying every other day. If you have coloured pillowcases you may want to consider daytime application only. I have oily skin so I double cleanse with an oil cleanser in the evening but you might not need this. I would start out with just the cleanser and BP gel. Don t change your entire routine at once.",2,True
1cm774s,"You do need to start using an actual cleanser though to remove the broken down dirt, sebum and the actual oils from the micellar water from your face after using it. You re kinda just smearing products on top of all that and that can t be making the pizza face situation better I actually use micellar water and CeraVe hydrating cream-to-foam cleanser to double cleanse and my skin looks less textured overall than before I started. I like the acnecide suggestion another user gave, however I find benzoyl peroxide to be a bit irritating which is why something called short contact therapy for BP exists and find salicylic acid to be just as effective without the irritation. Though ofc YMMV and you may end up liking it. Your routine could look something like Micellar Water optional, but still ok to use CeraVe Hydrating Cream to Foam Cleanser Benzoyl Peroxide or Salicylic Acid gel to Spot Treat Moisturizer of Choice- Right now I ve been loving the Aveeno Rehydrating Night Cream it can definitely be used both morning night, I have oily skin and find it to be very moisturizing yet without leaving my skin wet or greasy feeling! Maybe a bit of SPF to keep any scarring from acne as minimal as possible, as UV exposure can make acne scarring worse more stubborn to be rid of. Just wanna say I have PCOS too, and know of the struggle to conceive so congratulations and safe journey to motherhood! red_heart",1,True
1clwice,"They told you to wash your face 2x in the morning with 2 cleansers that have salicylic acid, and one is even a scrub? face_screaming_in_fear They even told you don t need SPF? Wth I think the Cerave blemish cleanser is a good place to start, use about 2-3x a week once a day . Alternate it with a gentle cleanser like the Cerave Cream to Foam or Aveeno Calm Restore Oat Cleanser, or Byoma Jelly Cleanser. You most definitely need an SPF during the day. Pick whichever as long as it s at least SPF 30, and reapply every 2-3 hours. Use 1 4 tsp for your face. If you re just starting out with retinol, start with 2x a week until you get used to it, then gradually increase frequency. Caveat I m not a derm or an expert, just an enthusiast. Regarding derms, I have a discount code for one of those online personalized product services, DM if you want to try it. Good luck!",7,True
1clwice,"This is a Fakespot Reviews Analysis bot. Fakespot detects fake reviews, fake products and unreliable sellers using AI. Here is the analysis for the Amazon product reviews Name CeraVe Blemish Control Face Cleanser with 2 Salicylic Acid Niacinamide for Blemish-Prone Skin 236ml Company Amazon Product Rating 4.6 Fakespot Reviews Grade B Adjusted Fakespot Rating 4.6 Analysis Performed at 02-18-2024 Link to Fakespot Analysis Check out the Fakespot Chrome Extension! Fakespot analyzes the reviews authenticity and not the product quality using AI. We look for real reviews that mention product issues such as counterfeits, defects, and bad return policies that fake reviews try to hide from consumers. We give an A-F letter for trustworthiness of reviews. A very trustworthy reviews, F highly untrustworthy reviews. We also provide seller ratings to warn you if the seller can be trusted or not.",1,True
1c4lo7v,"I ve read the comments and your replies and even though cold turkey is ok, I worry because you re a 16 year old boy so I assume you ll be physically active sweaty and you ll be using sunscreen. If these assumptions are true although your skin looks a bit dry in that lighting , I would still - clean with your Cerave cleanser or Simple at night - moisturise with your Cerave or Simple moisturiser You can just clean with water in the morning, but if your skin feels tight it might not, you are young , I would moisturise then, too. I agree with everyone else to drop the cleansing oil and toner for now. Note Simple original range is like . the least irritating range of products I know. Less irritating than Cerave, E45. But if you have no issues with Cerave, I don t see why you should spend more money.",2,True
1c4lo7v,"What was your routine like before you broke out? Personally I don t like Cerave. It made me red and irritated even though it s always recommended as a gentle brand by dermatologists. I think it used to be but they changed their formula when they got bought out some years ago. I think the culprit is the fatty alcohols in it. You can try swapping out those products as a start. The links above might be outdated, use Incidecoder or an app like Yuka to find updated lists of ingredients. Unless you wear makeup or waterproof sunscreen, you don t need a cleansing oil. So I would drop that for the time being too. The Anua 77 toner is a popular product but also not necessary, especially if you re trying to investigate what is causing breakouts and they started while using it. Try to stick with just non-Cerave cleanser, moisturizer, and a sunscreen and see if you see any improvement. On days when you don t need to cleanse like if you stay indoors all day and didn t use a sunscreen you can also try just cleansing with water. Personally, I use the Cetaphil gentle cleanser, Simple hydrating light moisturizer which has niacinamide, and a Korean sunscreen with niacinamide Skin1004 . Niacinamide for me has been great for anti-acne but it can also irritate some people so it s not for everyone.",3,True
1c4lo7v,"Stop using the oil, and the rest of your routine but especially the oil. If you re shaving razor that in itself takes off a layer of dead skin cells each time which is great for skin. As for a face wash try using the Cerave SA instead. You don t really need a moisturiser but if you must use a serum instead. A really good one is Superdrug Simply Pure Hydrating serum. Less products is better for hormonal temperamental teenage skin. Dermalogica products are really good",1,True
1c4lo7v,Yea problem is i ran out of the cerave cleanser and i dont want to buy more when im 50 50 on whether it helps or makes my acne worse,1,True
1c2etyw,"Cerave foaming wash broke me out. When I looked into it further I was reading about people saying the same thing and that foaming face washes can be irritating to acne prone skin, it made sense because my skin was doing better before I tried it and is doing better again now I stopped using it.",1,True
1c2etyw,"No problem, it was definitely the issue for me. I m trying out Cerave smoothing cleanser and Cerave Blemish control, both seem to be better for me than the other Cerave one.",1,True
1c18a2j,Came off the pill in January and forgot how oily my skin really is! I like using this one - Cerave Hydrating Foaming Oil Facial Cleanser,2,True
1by8ubp,"No problem! I use the ordinary squalene cleanser and for moisturising i swap between cerave moisturising cream when my skin is dry but not tight and Eucerin original healing cream drier skin than usual, this is a US product so I order it online. The eucerin original healing cream is basically the nivea cream but fragrance free its incredible for my dry skin. But none of these would make my skin feel better without a ceramide serum as I ve recently through trial and error have figured out that this has been the ingredient which has been relieving the tightness and dryness after ages of using hyaluronic acid and not seeing any relief. I used to double cleanse but my skin got so dry till the point where I couldn t anymore and the squalene cleanser is the gentlest cleanser ever and is good enough to remove everything. As for the soap question here is a thread with the top comment that explains it really well",2,True
1gndcip,"Spironolactone completely fixed my face. I use tret and an otc estrogen cream nightly, with whatever oil Im using at a given time mixed with vanicream. Get on Spiro, give it time to work and increase to a dose thats effective, and simplify your routine. I mix my tret and estrogen, and then my oil and lotion, so it s legit 3 steps. In the morning, I wipe my face with a damp wash rag, apply cerave, then sunscreen mixed with a tinted moisturizer and whatever liquid highlighter I have. Maybe a drop or two of drunk elephant bronzer if Im feeling pale. Edit I m 37.",2,True
1gnbkq2,"I landed on UV Clear tinted after a long trial of various ones, and am currently trying out the DRMTLGY dupe of that one b c the tint is better suited to my skin tone. My skin really likes the niacinamide in it and b c it s tinted I use it as my foundation skin tint. BUT, I recently had a reaction to a new product I tried and am not currently able to wear it b c it makes me flare up again -- my derm said likely the Octinoxate in it it s a mix of octinoxate and zinc sun filters . Her advice was to lay off everything other than my facial oil and CeraVe for 2 weeks and then try my SPF again. Edit b c she also said to try re-incorporating the SPF for a couple weeks before I add tret back. The idea is to allow the skin a good amount of time to heal.",1,True
1gmqk8o,"Timeless vitamin c Retinol is in a ton of brands, you can stick with the CeraVe if you like it",1,True
1gmqk8o,"As for retinol, this is also an ingredient that needs to be protected from degradation -- PLUS it needs to have so-called encapsulation technology i.e. combined with other ingredients so that your skin can absorb it. You can try the CereVe retinol but it s pretty weak, so won t give a ton of benefit. But it s a good one to start with so that your skin can get adjusted to the ingredient retinols can sometimes cause minor irritation when starting to use . Plus that is sold in a lot of drugstores so easy to find. Something a little better would be the Naturium Retinaldehyde 0.05 Once your on the 0.05 strength for 4 months, and your skin has fully adjusted to it i.e. no irritation , you can opt to increase the strength to 0.10 The retinols that work the best, and which are most potent, tend to be expensive. SkinCeuticals is the only one I d suggest for an experienced retinoid user, but it s pretty expensive. Note retinol and retinaldehyde are both retinoids They are very similar, but absorb a little different. So, you CANNOT compare a retinol strength to a retinaldehyde strength. Because retinaldehyde converts quicker in skin, you have to use a lower percentage formula. You can only apply retinoids at night time because sun light bright light destroys it.",1,True
1gkrwso,"Ya there are so many cerave products, this one was a recommendation from a dermatologist on Instagram years ago and I have never looked back. For the toners, depending on the humidity ratio at that time of year, I use the blue astringent ocean breeze or a witch hazel toner. Do you wash your face at night or in the morning or both? And have you seen a dermatologist for these concerns? Also am I the gigachad or are you? Lol",2,True
1gkrwso,"Good on you for taking initiative, my dude! As someone who has had a skin care routine since the 4th grade due to incredibly acne prone skin- I may be of help. INFO - what are your skin goals? Looking to cut down on oil production? Help clear up and prevent acne? Anything else? My first 3 things I would recommend to you and honestly anyone are easy and cheap 1. My skin has been a similar oily mess in the past so HEAR ME OUT but you know those toilet tissue paper covers that are in bathrooms? Those are a literal vacuum for oil. Pull out the top one and chuck it and then use the next, clean one and use the rougher side one side is a little more waxy, this side is not as affective and DAB your face NOT rub with the tissue liner. Literally pat it on your face, rotate to a clean part of the tissue, and keep going all over your face this way. By dabbing, it will absorb up the oil. I personally had to do this around like 1-3 pm and then at like 5. This was recommended to me by an aesthetician when I was a pimply, junior high mess and I scoffed and thought it was gross but she said she has done this for years. And now I have and never had any pink eye or gross reactions. Those oil blotting tissues really added up in cost after a few years so this was a great alternative. 2. When washing your face, try to air dry your face, don t dry your face with a towel. I will dab my eye brows and neck but that s it, everything else never touches a towel. If you think about it, your towel is probs a breeding ground for germies so simply don t use one to dry your face. 3. For body acne, i have found that the cerave acne foaming cream cleanser 4 is the perfect balance for my body acne. I will wash my body with this and then I use an exfoliating body wash cloth with a neutral body wash on the cloth and scrub my whole body after putting this cleanser on. The cleanser works the best if it has a bit of time to sit on my body, so the cleanser goes on then I scrub with it still on. Post shower I also have found using toner on a cotton pad on the affected areas creates a little bit of a seal.",1,True
1gkrwso,"Then the downvotes were worth it. The gigachad has arrived in the house, everyone. To answer you, yeah, I basically would love to not be leaking oil on my face constantly throughout the day. People always say don t touch your face with your fingers, but for me it s the opposite. My fingers are nice and dry right now and if I rub them across my forehead, they become slimy and gross. It s so so unattractive to glisten like I ve oiled myself for an 1980 s workout VHS tape. Everything you ve said is something that is new to me so thank you so much for sharing because I will go out and try exactly what you suggest- I ve never heard of that Cerave product because frankly they make way too many overlapping products that I never would have picked it at random. Stay frosty two_hearts",1,True
1gka1bv,"Consider the sources these are people who have an interest in you feeling insecure about your skin and maybe paying them more money. For my ridiculously dry skin, the winners are Amore Pacific line brought my skin back to life. It s super expensive so I couldn t afford to keep up. Then I did well with the Peter Thomas Roth Water Drench line. These days, my broke self is using Hyaluronic Acid and a moisturizer from The Ordinary, Tatcha sunscreen, and still working out a nighttime routine. Currently Paula s Choice BHA and Cerave nighttime. My skin is doing good these days. I m not sure if jumping directly to my current routine would have fixed the issues I had at my worst. No way to know now. Last thing - make sure you re exfoliating enough. I need to exfoliate frequently. Despite being sensitive to perfumes, I can wear The Ordinary s glycolic acid at least every other night. If you can see flaky skin, or if moisturizers or makeup tend to sit on top of your skin, you may need more exfoliation. Then the moisturizer doesn t need to fight to get to the healthy skin. Caution - go slow with exfoliation. Too much is worse than not enough. Damage can take a long time to repair. I hope you find your magic mix.",2,True
1gka1bv,"I know you said no CeraVe, but have you ever tried their Skin Renewing Night Cream? I mention this one a lot. My skin can get flaky in winter and I use this religiously.",1,True
1gka1bv,"I have dry skin from spironolactone and I m also acne prone -- an annoying combination. I ve tried so many things but what I ended up sticking with is massaging in hemp seed oil after I cleanse, CeraVe Moisturizing Cream over that a lighter touch in the a.m. but heavier in the p.m. , and I ll typically pat a little extra hemp seed oil over the moisturizer, too. I also have recently been trying out a hydrating toner that is urea-based and that has really made my skin look so plump and hydrated.",1,True
