post_id,body,score,contains_term
1gj4vvm,"It looks to me like your skin s moisture barrier is compromised, which is why you re oily flaky. I have been through this before, what worked for me was paring my routine down to just the basics till it righted itself. My rec would be to cut out all actives and even the PM moisturizer and go down to cleanse in the evenings sunscreen during the day, rinse with water only in the morning, etc. for a couple of weeks to see if it calms down. The only two things you really have to do is sunscreen cleanser to remove sunscreen. Were you using different cleanser, moisturizer, etc. when your skin was clearer? It s worth noting that cerave works for a lot of people and for others it causes breakouts. If you were using different products before, I d retreat to those and a really simple routine for a few weeks and see if it makes a difference.",2,True
1giqurr,Do you like this better than cerave?,6,True
1giqurr,I do. The only cerave product use occasionally now is cerave pm. I don t know what happened but my eczema flares up using cerave now,9,True
1gfucrt,"This looks more like blind pimples than texture, I would change out your current routine. CeraVe doesn t agree with everyone.",14,True
1gfucrt,"From this sub and from others like it ditch the CeraVe and use plain vanicream bar soap and moisturizer. CeraVe has a bunch of ingredients that can make acne worse. I ve found that I react to cetyl alcohol, stearyl alcohol and salicylic acid. They destroy my skin barrier and cause further breakouts. And LRP cicaplast has Shea butter, which also can cause breakouts, I have it and have to use it on my hands instead cause it s too thick and occlusive for my face. I ve been using vanicream lotion, their bar soap, and retin-a tretinoin .25 , and a mineral sunscreen, and my skin is mostly clear with the occasional hormonal breakout. I hope this helps!",2,True
1gel17n,"Hi there! You may have dry skin which can also sometimes mean more sensitive so a very elaborate skincare routine with 16 products would be unnecessary and not helpful. Your routine is simple and that s already very good. I think something that could help you is to add more moisturizing products and maybe doing a double cleanse at night just to be extra sure you have gotten off all the makeup and sunscreen completely off. That CeraVe hydrating cleanser is great, I would stick with that and maybe try the Hydrating Cream To Foam the bottle with the green text on it which is their newer version. It foams up nicely and gets off makeup and sunscreen off a little better than the regular CeraVe hydrating one but is still gentle and not stripping, perfect combo for someone with dry skin. There are cleansing balms you can buy which is the first thing you use at night after washing your hands. It looks like a thick lotion in the container but as you scoop some out and rub it all over your face, it becomes oily and dissolves everything dirt makeup oil etc. so use this first and then rinse off. Then use your CeraVe wash. That s what makes it a double cleanse Last thing I might look into is an over the counter retinol and adding in a hyaluronic acid serum. Retinol needs to be applied at night only, after you wash your face and pat it dry. Retinols can be irritating so use only once a week at first and try to find one that s a lower percent or a weaker one, or maybe one that s targeted for dry skin people. Hyaluronic acid can be applied whenever really, you can put a small amount of it under your moisturizer in the morning or at night, you can put it under your sunscreen also. It ll help plump up the skin and make it look less dry. Introduce products one at a time if possible so if something doesn t suit you, you will be able to know which one is causing an issue. If you can find something to exfoliate with once or twice a week, like Paula s Choice 2 BHA, that can help you too, it s not a necessity but it ll help slough off dead skin over time. Retinol can have an exfoliating effect as well so I would choose one or the other - don t be using both at the same time or your skin might peel and become irritated. I am not a dermatologist but this is just what I would recommend as a fellow dry skin person in their early 30 s. I hope this helps x",1,True
1gedrfg,Vanicream! My skin did lot like Cerave or Cetaphil either.,41,True
1gedrfg,CeraVe was the worst for me. Gave me huge breakouts of deep cystic acne all over my face neck and back. Never again. I really like Cetaphil if you haven t tried it yet.,14,True
1gda36e,I switched to Cerave. No sure it s the best but I was way over exfoliating before I switched,1,True
1gd72bz,"Is rosacea the only thing you re trying to address? If so the geek and gorgeous serum is the only thing in your about to add routine that would potentially address that. Why do you want a salicylic acid wash? From what I know SA is not very effective for things like clogged pores, acne etc in the wash formula because it needs to stay on your skin for some time to work, it also might make rosacea worse so watch out for that. I ve been eyeing Paula s choice spf 50 with vitamin C but haven t tried it yet, they usually have great skincare. Personally I have combination sensitive skin with rosacea and I either use ultraviolette tinted veil spf 50 as my foundation or lrp anthelios fluid spf 50, cerave moisturising lotion, and the best oil wash for me has been bioderma cleansing oil followed by avene foaming cleanser since I m acne prone, I also use retinaldehyde by geek and gorgeous for my fine lines although retinoids aren t recommended with rosacea, but it doesn t seem to make mine worse. I have a centella serum which has been fine but a cream in the past has broken me out too.",2,True
1gd72bz,"If the Facetheory doesn t work try Murad Environmental Shield Essential-C Day Moisture SPF 30 or like another person mentioned, Paula s Choice 5 Vitamin C Sheer Moisturizer SPF 50 I would for sure add the Geek Gorgeous Azelaic Avid or any Azelaic acid since it is really such a great ingredient to fight rosacea redness. I haven t tried this product so I can t really comment on it but if you haven t bought it or want any recommendations, let me know! Paula s Choice and The Ordinary have 10 ones that are great. Like another user mentioned, cleansing oils! I would substitute the makeup remover balm for a cleansing oil since it also has skincare properties! I swear by the DHC Deep Cleansing Oil but here are a few options Biossance Squalane Antioxidant Cleansing Oil, Vichy Puret Thermale Calming Cleansing Micellar Oil, Vichy Cleansing Oil, Bioderma Sensibio H2O Micellar Oil, La Roche-Posay Toleriane Cleansing Oil, Avene Cleansing Oil, Bioderma Atoderm Cleansing Oil, Bioderma Hydrabio Cleansing Oil. Cerave and Burt s Bees have a few options too. If your skin is currently sensitive I would try maybe Niacinamide before Salicylic Acid. It is gentler. At least until your barrier heals a little and or the redness goes down. A few great products are Paula s Choice 10 Niacinamide Booster, The Ordinary Niacinamide 10 Zinc 1 , Inkey List Niacinamide Serum, SkinCeuticals Discoloration Defense, Cosrx Galactomyces 95 Tone Balancing Essence, First Aid Beauty Ultra Repair Hydrating Serum Or if you really want Salicylic Acid, the La Roche-Posay Effaclar Duo Acne Treatment has both Niacinamide and Salicylic Acid. For Centella, I really like the Dr. Jart Cicapair Tiger Grass line and La Roche-Posay Cicaplast Baume B5. Although this product doesn t have Centella, I really love it COSRX Advanced Snail 96 Mucin Power Essence Hope this helps!",1,True
1gclf61,Try switching to a more hydrating cleanser. The Cerave Foaming cleanser is probably too stripping. I agree with the comments that this looks like rosacea. I have it and my skin calmed down a lot when I switched to hydrating cleansers e.g. La Roche Posay Toleriane dermo-cleanser .,3,True
1gaqq46,"I personally find CeraVe products to be trash ever since they got bought out and changed the formula. You could try adding a retinol into your routine to help with aging. Otherwise a pretty solid routine with the cleanser, moisturizer, and sunscreen.",-1,True
1gneazx,"Sounds like you have already got a basic routine down, but a few tweaks might help - Hydrate, Hydrate, Hydrate. It sounds simple, but keeping hydrated really does make a big difference. - Add Moisture Layers. Consider layering a hyaluronic acid serum like The Ordinary s or La Roche-Posay s right after cleansing. This draws moisture into the skin, which can plump up those lines over time. Then, lock it in with a moisturiser. I use Cerave the one in the big tub , but you might have to experiment and find one that works for your skin. - SPF is Non-Negotiable, even on cloudy days. UV exposure is the number one cause of premature aging, so if you re not already, find a broad-spectrum SPF 30 that you like. This can help prevent those rough or aged appearances. - Retinol. You re already doing great exfoliating 3 times a week but consider a Retinols, a prescription retinoid like Differin if possible. This will help target fine lines, wrinkles, and skin texture. Start with a lower concentration to see how your skin tolerates it like 0.25 or 0.5 and apply it only 1-2 times a week to start. You ll want to pair this with your SPF, as retinoids make skin more sensitive to the sun. - Eye Cream with Peptides to address the lines under your eyes, look for an eye cream that includes peptides or caffeine to help smooth and tighten the skin around your eyes. Caffeine can reduce puffiness, while peptides support collagen production, helping with elasticity.",33,True
1gml5z3,Take a break from Cerave and try another moisturizer. It s most likely clogging your pores. It did that for me,5,True
1gg8kxn,"Hey! Thanks for your response. My photo is crap the detail is lost but I do have what looks like blackheads all over my nose and lower chin. I try not to squeeze but when I do, the black rubbish comes out. Would you say the CeraVe Hydrating cleaner face wash would be a good swap? I ll take a look at no oil moisturizers. I thought they may help soften and hydrate my face if they contain oils? Thanks!",1,True
1gg5mn2,"I was thinking if toner is after eye cream you could be rubbing off the eye cream, plus the hydrating toner would be nicer under eyes before the eye cream. You also don t necessary need an eye cream and can use your moisturizer. I like an eye cream because my face moisturizer isn t hydrating enough for my under eye bc I m breakout prone. Skinceuticals c e ferulic is a top vitamin c but very expensive. Fig1 Vitamin C is supposed to be a good drugstore dupe. Vanicream, cerave and cetaphil are good brands and all make vitamin C but I m not sure about their vitamin C in particular. I use skinbetter alto advanced but it s more of a combo antioxidant. My fave micellar is bioderma When deciding your order of steps do thinnest to thickest so toner would be first then serums in order of thickness etc The most important thing is to add products slowly over weeks one at a time so you don t end up with unhappy skin",2,True
1gee00y,"The Eucerin hydrating cleansing gel is fine but it s a downgrade from the CeraVe foaming oil cleanser imo. The Neutrogena daily ultra gentle is basically worthless. It s not bad but it doesn t actually have any cleansing power. It s like water cetyl alcohol. There s not much else to it. It s the one I ve been using the last 2 months. I don t hate it. It s objectively good enough, but I don t think I ll repurchase once I m done simply because I m not settling for good enough . The new Neutrogena CTF looks nice but I suspect less gentle than the CeraVe oil cleanser. Still worth checking out probably since it s still gonna be nice for body if nothing else. Purpose cleanser looks awful. Not gentle and it s fragranced. Eucerin body and face looks alright but not the gentlest. I haven t tried it. It depends what the concentration of SMS is. I wouldn t keep my hopes up. I just got this today and tried it on hands. Really pleased with the first impression. Going to try on body and face and hair just because that s what I like doing grinning_face_with_sweat first impression was it felt like a rich, high density lotion and spread very well. It rinsed well with no real residue. It had a slight sensory feeling while drying but after it dried it just felt moisturized without feeling filmy, which I was not expecting. I hope it feels equally good on face body. My standard for comparison is going to be the Aveeno Calm And Restore Oat Cleanser which I really like so we will see. I don t know how they ll handle waterproof SPF though. Might need a second pass at least.",2,True
1gbyfns,Does the Cerave wash occasionally burn your skin?,2,True
1gael7h,"The CeraVe foaming cleanser is very drying, which can make your skin produce excess oil to compensate. You might try switching to the hydrating cleanser or the foaming hydrating cleanser. Also, I found that toner made me feel oily, so maybe switch to another one. I like the Thayer s milky toner.",1,True
1g8rrot,"I was using cleansing oil, then switched to the cerave acne control cleanser because it was working a couple of months ago. I have no idea why these breakouts appeared because I didn t change anything at the time. Antibiotics helped, and now I m using a hydrating cleanser with an oil cleanser every couple of days.",1,True
1g6qnwk,"No need to apologise! You re welcome, if there are blackheads then I would suggest the COSRX blackhead liquid power, it s priced similarly to CeraVe, I ve found it super effective with my blackheads. Also it looks like you have really great skin",1,True
1g64w9w,CeraVe Daily Moisturizing Cream Has a shelf life of 12 months after opening. CeraVe Resurfacing Retinol Serum Has a shelf life of up to 6 months after opening. Unopened CeraVe products Have a shelf life of at least 3 years if stored at room temperature. Hope this helps,2,True
1g64lvk,"Oils always last. If you want to add a retinol add it by itself 1-2 times a week at first retinol, moisturizer, oil , and then add the other products slowly. Sometimes the overuse of actives can irritate the skin, so I don t use other actives on nights I use the retinoid. Also, the cerave retinol serum has niacinamide in it anyway.",2,True
1g4rux5,"Lowkey nizoral anti-dandruff shampoo worked for me as well as moisturizing with Cerave reg lotion bio oil skincare oil - I also really found that even just using bio seems micellar water with a cotton round after cleansing before my serum and moisturizer made a Huge difference. It s sorta like an anti bacterial Cleary for your face but you don t need to wash it off after, my skin liked it but we are all diff so set don t take this advice as fact just my recommendation based on experience!",1,True
1g4f37x,"Cerave s retinol percentage is on the low side but on the plus side, it s encapsulated so this means that it is likely to remain stable inside the skin and convert into meaningful amounts of tretinoin. Some brands have 0.3 non encapsulated and in dropper bottles so who knows how much of that remains stable and converts. I believe Neutrogena uses encapsulation at higher percentages 0.3 to 0.5 so this could be a good option if you want stay in the affordable realm.",2,True
1g42i69,"Out of curiosity, I put this question through ChatGPT and got the following Using both benzoyl peroxide BP and salicylic acid SA can be effective for acne, but combining them could lead to irritation if not balanced properly. Here s a breakdown of what you might want to consider Day Routine Benzoyl Peroxide Cetaphil 2.6 BP Wash This can help clear acne but might be drying if used daily. BP can also make your skin sensitive to the sun, so a gentle cleanser could be a good alternative if your skin becomes too dry. Neutrogena AM Treatment 2.5 BP Applying BP twice in the wash and treatment might be overkill for some people, especially if your skin is sensitive. You could try alternating the wash or treatment on different days. Cerave SPF 30 Moisturizer Good choice to counteract the drying effect of BP and protect your skin from sun sensitivity. Night Routine Salicylic Acid Cerave 2 SA Control Cleanser SA is great for exfoliating and preventing clogged pores. This cleanser should work well in combination with your morning routine but might cause dryness over time. Cerave 2 SA Control Gel Applying another layer of SA after using an SA cleanser could be too much, potentially leading to irritation, especially when combined with your morning routine. Clean Clear Moisturizer 0.5 SA Another SA product may compound the drying effect of the others, leading to irritation. Adjustments Balancing Active Ingredients Using both SA and BP multiple times a day could dry or irritate your skin. Consider Alternating Days Use BP in the morning on some days and SA at night on others to avoid over-exfoliation. Gentler Cleansers Maybe swap out one of the active cleansers BP or SA for a gentler option, so your skin has a break. If you notice redness, peeling, or excessive dryness, you may need to scale back on one of the active ingredients.",2,True
1g42i69,"It sounds like a lot of actives in a day honestly. I feel like one use of an active cleanser may be enough and anything more may irritate, but I m no expert. Personally I try to only use actives every other day or a gentle active cleanser once daily like the sa cerave cleanser otherwise I would breakout or get skin irritation. This was especially the case when I used benzoyl peroxide every day. I also heard it s better to cleanse at night only rather than in the morning and night unless you have really oily skin.",1,True
1gn26x0,"a moisturizer isnt for anti aging, it just helps the stuff thats actually for anti aging retinoids from drying your skin out and just keeping your skin from feeling uncomfortably dry in general if you have that issue. try patch testing behind your ear or on your jaw line, which will be better for knowing how your face will react. as someone who doesnt like cerave or cocokind products on my face and only really uses cetaphil moisturizer on my neck and eyes, here s my reccs 1. purito oat gel. this is a very lightweight gel that has a glowy finish. buy this from a verified retailer such as yesstyle, not amazon. 2. tower28 sos moisturizer. this is a thick moisturizer but has a very natural, skin-like finish. you cant really tell you have it on. i would not recommend this for hot and or humid weather, however, since it can be pretty heavy in such an environment and makes you sweat more. great for dry skin and normal cool weather though! also, i have eczema and sensitive skin if that gives me credibility at all. tower28 skincare is all eczema association approved iirc. edit my advice is, unfortunately, to just keep trying stuff until you find what fits for you. try to avoid common irritants like essential oils and some acids, pore cloggers like shea butte oil etc., and look for simple ingredient lists so you dont have as high a risk of irritating your skin as you do with a long one.",3,True
1gn0eoo,"Nothing wrong, it might just be cystic acne. I had it in HS a bit in college- they hurt! I m now on Spironolactone prescription and I get about 1 cyst per year 45 years-old. I was also on Accutane in high school. Also, try a blue light for less bacteria. I purchased a 3-n-1 IPL flash hair remover. Hair reducer, red light blue light adapters. I just zap a few times when i feel a painful one coming on! PS. Cerave has a nice light sunscreen ultra light moisturizing lotion, SPF 30 many Asian sun milks are great for cystic acne.",4,True
1gmm86x,Cerave has a Salicylic Acid Lotion and Body Cream for rough and bumpy skin that has really helped me with my chest and back acne. I think it s better than the body wash you use because it s not a wash off formula. I would start by using a basic soap no actives and then use the lotion or cream,1,True
1gmm86x,Cerave benzoyl peroxide 10 wash daily use white towels it can bleach . Hypocyn spray throughout the day. If you want you could see a doctor for a prescription of doxycycline to really kick it.,1,True
1gmlltf,"The ditch the acne cleanser in the morning. All it does is dry out your skin which can cause the redness. And then you re using another acne product on top of that. Which is just going to dry it out and irritate it more. Use a very simple cleanser like the one you use at night or you can even use vanicream. In my experience the cerave moisturizer broke me out like crazy. Some people it works for, others it breaks them out a lot. The acne treatments like the benzoyl peroxide and the clindamycin will kill the acne. Instead of the cerave I would suggest the aveeno calm and restore, it has next to no cometogenic ingredients. For me it did not trigger any acne and my dry skin with good with it.",1,True
1gmcgdx,"I had this for years. Hands bleeding and cracked. It was the hand soap I was using. I started using Cerave foaming cream cleanser for face on my hands. I wear gloves when my hands will get wet for extended periods - cleaning, etc. I still have these fissures but they are so much less. Lolo Body helps. Good luck.",1,True
1gm2j39,I had the same experience with Cerave and most sunscreens the only one that s never irritated me is the Neutrogena invisible faily defense facial serum sunscreen. Not positive if it is mineral or not. Tinted EltaMD worked okay for me as long as I avoided my eyelids,1,True
1glwb7t,"Hi dear, maybe I can give you some ideas products to try. First off, the diet plays a crucial role in your overall skin health. Maybe your system has developed a new sensitivity? It could be laundry detergent, perfume, dish soap, cleaning products, citrus fruit, gluten, anything lol.Im not gonna mention blood work and all that because I m sure you ve done that! Try to eliminate things that could trigger it and switch to green, 100 non toxic natural things. Always always wear gloves. You could try castile soap which can be used for laundry, dishes, fruits veggies, cleaning and body hair although it s too drying on my sry skin. I use black African soap for my hair and body. I use a lot of Shea moisture products, their honey hair mask is divine. I m actually not the biggest fan of cerave, they re just OK imo. But their HEALING OINMENT IS SOOO GOOD lol I use it all over,i really recommend you try it in place of Vaseline. Warm it up and only need the smallest amount. Have you tried pine ta tar? It s amazing, it s antiseptic and antifungal, very healing, look up cutar emulsion on amazon panthenol for healing, very important ingredient. Calendula, soothing, nourishing, healing. Anecdotally, I ve heard amazing things about vit D cream for even curing eczema. Colloidal oatmeal is very soothing and takes away the itch and irritation. Sulfur, another smelly one but it WORKS with my skin so well. German chamomile u could get essential oil and mix it with a cream AND take it internally, makes a delicious tea. Pair it with Manuka honey BAM! I do Manuka honey masks or leave it on a problem area when I m home reading etc and wipe off before bed because it s sticky but also could be mixed with other ingredients in a cream. Try making your own of all the ingredients you like, a SUPER POTION. add some aloe, goat milk, sea buckthorn oil cold processed and organic of course oh and HEXANE free. I have more to share but trying to keep it a chapter VS a book, haha. All these ingredients have been studied and praised for their efficacy. You should also be supplementing with HIGH QUALITY herbs and supplements. There are so many superfoods which are medicine. God s medicine 3 I rally urge you to dive into your own research, and heal yourself slowly with care and love. Feel free to message me or comment if u have any questions, I m an ayurveda yoga teacher and healing is my passion. I have a huge love for herbal medicine. My own healing journey took me on this path and changed my life. All the best to you! Hugs!",2,True
1glwb7t,"Hey there, thank you so much for your thoughtful and detailed response I really appreciate you taking the time to share all these insights! herb folded_hands I ve definitely been looking into various triggers that might be affecting my eczema, and I agree, diet and environmental factors play a huge role. I haven t pinpointed any specific sensitivities yet, but I m slowly making changes to see what might help. I ve actually tried pine tar soap before, but I haven t experimented with Cerave s Healing Ointment, so I ll definitely give that a try based on your recommendation especially with warming it up and using a smaller amount. I also love the idea of incorporating ingredients like calendula, colloidal oatmeal, and German chamomile. Your suggestion of using Manuka honey for its healing properties is really interesting too. The idea of making a custom blend with some of the natural ingredients you mentioned is intriguing. I m excited to experiment with creating something more tailored to my skin s needs. Thank you again for your suggestions and encouragement. I can tell you ve put a lot of love and research into this, and it really shows. I ll keep exploring these options and take a closer look at herbal remedies. I may reach out if I have more questions as I dive deeper into this journey! green_heart",1,True
1glvan1,"Keep using Cerave if it works for you. Parabans don t cause hormone disruption in the concetrations they are in your skincare, they are just acting as preservatives. watch this",1,True
1glqyyx,It s just a spot treatment but you would use it in place of the cerave acne gel,1,True
1glh4y8,"im using the other cerave gentle claner the green one, that s fine right? also i heard about ceramides, is this working with oral ceramides supplement or ceramide serum? working to rebuild skin barrier",2,True
